{
  "schema": "trajectory/1",
  "trace_id": "mock-trace-pass",
  "recorded_at": "2026-02-01T00:00:10Z",
  "provenance": {
    "model": "mock-model-b",
    "agent_type": "executor",
    "prompt_version": null,
    "task_fingerprint": "task:fix-auth-bug"
  },
  "spans": [
    {
      "span_id": "p0",
      "parent_span_id": null,
      "operation": "invoke_agent",
      "name": "invoke_agent executor",
      "start_ts": "2026-02-01T00:00:00Z",
      "end_ts": "2026-02-01T00:00:07Z",
      "duration_ms": 6800,
      "agent_type": "executor",
      "model": "mock-model-b",
      "self_report": "completed",
      "attributes": {}
    },
    {
      "span_id": "p1",
      "parent_span_id": "p0",
      "operation": "chat",
      "name": "chat",
      "start_ts": "2026-02-01T00:00:01Z",
      "model": "mock-model-b",
      "tokens_in": 90,
      "tokens_out": 18,
      "finish_reason": "tool_use",
      "attributes": {}
    },
    {
      "span_id": "p2",
      "parent_span_id": "p1",
      "operation": "execute_tool",
      "name": "execute_tool Read",
      "start_ts": "2026-02-01T00:00:02Z",
      "duration_ms": 38,
      "tool_name": "Read",
      "attributes": {}
    },
    {
      "span_id": "p3",
      "parent_span_id": "p0",
      "operation": "chat",
      "name": "chat",
      "start_ts": "2026-02-01T00:00:03Z",
      "model": "mock-model-b",
      "tokens_in": 110,
      "tokens_out": 28,
      "finish_reason": "tool_use",
      "attributes": {}
    },
    {
      "span_id": "p4",
      "parent_span_id": "p3",
      "operation": "execute_tool",
      "name": "execute_tool Write",
      "start_ts": "2026-02-01T00:00:04Z",
      "duration_ms": 14,
      "tool_name": "Write",
      "attributes": {}
    },
    {
      "span_id": "p5",
      "parent_span_id": "p0",
      "operation": "chat",
      "name": "chat",
      "start_ts": "2026-02-01T00:00:05Z",
      "model": "mock-model-b",
      "tokens_in": 130,
      "tokens_out": 22,
      "finish_reason": "tool_use",
      "attributes": {}
    },
    {
      "span_id": "p6",
      "parent_span_id": "p5",
      "operation": "execute_tool",
      "name": "execute_tool Bash",
      "start_ts": "2026-02-01T00:00:06Z",
      "duration_ms": 240,
      "tool_name": "Bash",
      "attributes": {}
    },
    {
      "span_id": "p7",
      "parent_span_id": "p0",
      "operation": "chat",
      "name": "chat",
      "start_ts": "2026-02-01T00:00:07Z",
      "model": "mock-model-b",
      "tokens_in": 140,
      "tokens_out": 55,
      "finish_reason": "end_turn",
      "attributes": {}
    }
  ]
}
